{
  "$schema": "https://json-schema.org/draft/2020-12/schema",
  "$id": "https://delimit.ai/schemas/grounding/event.schema.json",
  "title": "GroundedEvent",
  "type": "object",
  "required": ["event_id", "type", "date", "venture", "evidence_refs", "visibility"],
  "additionalProperties": false,
  "properties": {
    "event_id":     { "type": "string", "pattern": "^evt-[a-z]+-.+" },
    "type":         { "enum": ["feature_shipped", "release", "incident", "incident_resolved", "decision", "outreach_event", "attestation", "commit"] },
    "date":         { "type": "string", "format": "date-time" },
    "venture":      { "enum": ["delimit", "domainvested", "wirereport", "livetube"] },
    "evidence_refs": {
      "type": "array",
      "minItems": 1,
      "items":  { "type": "string", "pattern": "^(LED-|sha256:|git:|attest:|url:).+" }
    },
    "claims":       { "type": "array", "items": { "$ref": "claim.schema.json" } },
    "visibility":   { "enum": ["public", "internal", "private"] },
    "source":       { "type": ["string", "null"] },
    "raw":          { "type": ["object", "null"] }
  }
}
