{
  "event_id": "evt-att-att_a05050eb8e13277e",
  "type": "attestation",
  "date": "2026-04-23T23:52:51.823Z",
  "venture": "delimit",
  "evidence_refs": ["attest:att_a05050eb8e13277e", "git:ff0c729fda7b"],
  "claims": [],
  "visibility": "public",
  "source": "attestation",
  "raw": {
    "attestation_id": "att_a05050eb8e13277e",
    "kind": "merge_attestation",
    "wrapped_exit": 0,
    "signature_alg": "HMAC-SHA256"
  }
}
