{
  "event_id": "evt-ledger-LED-release-v4.3.4",
  "type": "release",
  "date": "2026-04-24T01:39:29Z",
  "venture": "delimit",
  "evidence_refs": ["LED-1079", "git:67578dc54e77"],
  "claims": [
    {
      "claim_id": "CLM-release-v4.3.4-test-count",
      "type": "aggregate",
      "text": "165 tests pass on delimit-cli v4.3.4.",
      "evidence_refs": ["git:67578dc54e77"],
      "visibility": "public",
      "numeric_evidence": {
        "value": 165,
        "unit": "tests",
        "commit_sha": "67578dc54e77b7dfbed0f6a9ce18baa4ae695c91"
      }
    }
  ],
  "visibility": "public",
  "source": "ledger:release"
}
